question,answer
Những phụ nữ nào không nên sấy tóc?,"1. Những người chuyên làm việc ngoài trời trong thời gian lâu dài hoặc lưu động trên đường thường xuyên. Về mùa hè đầu tóc những người này thường xuyên tiếp cận, phơi ra dưới nắng mặt trời gay gắt, các tia tử ngoại trong ánh nắng dễ làm tổn hại chất tóc, làm cho đầu tóc trở nên khô, giòn, dễ gãy, dễ rụng. Về mùa đông, họ làm việc ở bên ngoài trời lạnh, giá rét, dễ làm cho các huyết quản ở da đầu luôn ở trạng thái co lại, làm cho đầu tóc không đủ chất dinh dưỡng, nếu lại dùng nước thuốc hóa học trong uốn sấy tóc nữa thì càng làm tổn hại nặng hơn với đầu, tóc. 2. Những phụ nữ thời kỳ mang thai và trong vòng nửa năm sau khi sinh: Ở thời kỳ này, trạng thái sinh lý của phụ nữ bao gồm cả nội tiết trong cơ thể đều có những thay đổi khác lúc bình thường, chất tóc lúc này giòn, yếu rất dễ gãy, rụng, nếu lại uốn sấy, phải sử dụng đến loại thuốc hóa học nói trên thì chất tóc cũng như da đầu lại bị tổn thương nữa, như vậy sẽ dễ bị gãy, rụng hàng loạt nhiều hơn gấp bội và màu tóc, chất tóc đều không giữ được xanh đen, óng mượt nữa. 3. Những ngượi bị bệnh truyền nhiễm trong vòng 2 tháng sau khi đã chữa khỏi bệnh: Người bệnh lúc này không những tình trạng sức khỏe toàn thân đang tương đối kém, đầu tóc cũng ở trong tình trạng dinh dưỡng kém hơn bình thường, chất tóc cũng đang giai đoạn khô cằn, sau khi uốn sấy tóc sẽ càng nhanh chóng gãy rụng, biến màu, biến chất. Những người bị các chứng ung nhọt khi tiến hành điều trị bằng các loại thuốc chống ung thư, u nhọt dễ làm cho người bệnh rụng tóc hàng loạt, có khi trụi hết, cho nên thời gian này cũng không được uốn sấy tóc. 4. Nhũng người đã rụng tóc nhiều do bị các bệnh gây nên: Như bị bệnh tuyến giáp, bệnh về nội tiết mất điều hòa, bị những bệnh về thiếu chất sắt hoặc bị khối u ở buồng trứng, vì những người này vốn đã rất dễ rụng hàng loạt tóc, cho nên không nên uốn sấy tóc, hại không chỉ đối với đầu tóc mà còn hại cả sức khỏe nói chung nữa."
Làm đẹp tuổi đôi mươi,"Với những tông màu tươi sáng kết hợp với cách trang điểm nhẹ nhàng, các bạn gái đã �tạo� cho mình một khuôn mặt xinh xắn cho những buổi họp mặt, dự tiệc mà vẫn không làm mất đi nét đẹp tự nhiên. Nền: Chú ý chỉ nên dùng thật ít phấn nền đánh đều lên mặt một lớp thật mỏng sao cho da mặt thật tự nhiên. Chân mày: Chọn chì màu nâu vàng định hình khuôn chân mày, sau đó dùng mascara màu nâu chải đều những sợi lông mày nằm vào khuôn đã định. Mắt: Dùng màu cánh gián cam tán đều khắp bầu mắt và màu xanh chuối đánh vào mí dưới. Dùng mascara màu đen chải thật kỹ từng sợi lông mi từ trong ra ngoài. Má hồng: Dùng màu cam nâu đánh thật nhẹ phớt vào phần cao nhất của xương gò má tán nhẹ dần vào thái dương. Môi: Chỉ nên dùng son bóng màu hồng cam thoa đều hai cánh môi."
Tạo nét duyên cho khuôn mặt dài,"Với khuôn mặt dài, ngoài cách trang điểm như gợi ý sau đây, bạn nên chọn trang sức hình tròn kết hợp với kiểu tóc đơn giản như bồng nhẹ hai bên má, tóc mái xéo một bên. Chân mày: Bản to, mỏng dần về phía đuôi. Chải nhẹ bột phấn màu vàng nâu sao cho tiệp màu với tóc. Dùng chì đen thực hiện tương tự với tóc đen. Mắt: Tạo vẻ mới lạ với đôi mắt được gắn kính sát tròng màu xanh dương, bấm lông mi 5- 6 lần từ trong ra ngoài và chải mascara, viền chì nâu ở mí mắt dưới. Má hồng: Ðánh má hồng nơi gò má gồ lên. Ðồng thời phủ phấn hồng dưới cằm. Môi: Dùng son màu hồng phấn"
Làm gì để tăng chiều cao?,"Chiều cao cơ thể con người sẽ còn phát triển đến năm 25 tuổi nhưng sau tuổi dậy thì sự phát triển chiều cao đã chậm lại. Muốn tăng chiều cao em cần ăn đầy đủ các loại thực phẩm. Chú ý các nguồn thực phẩm có calci như sữa, cua đồng, cá, mè, rau xanh, nghêu sò... Cùng với chế độ ăn, cần kết hợp tập luyện, chơi các môn thể thao như bơi lội, nhảy dây, cầu lông, xà đơn từ 45-60 phút/ ngày. "
Ngủ nhiều cũng là bệnh,"Có thể con ông bị chứng ngủ rũ với đặc điểm xuất hiện các “cơn buồn ngủ” không thể cưỡng lại được, ở bất cứ nơi đâu và bất kỳ lúc nào trong ngày dù cho đêm hôm trước cháu đã ngủ tốt, cả về mặt chất lượng lẫn thời gian. Ở nhiều người, khi cơn buồn ngủ xuất hiện nhiều lần trong ngày thì có thể gây nguy hiểm vì bệnh nhân có thể ngủ trong khi lái xe. Ngoài triệu chứng ngủ, bệnh nhân còn kèm thêm những cơn liệt hay yếu cơ thoáng qua và có thể bị ảo giác lúc sắp thức hay sắp ngủ. Giấc ngủ ban đêm của bệnh nhân cũng thường bị gián đoạn. Nhìn chung, thuốc và tâm lý liệu pháp hành vi có thể giúp ổn định triệu chứng, nhưng đầu tiên ông cần đưa cháu đến bác sĩ tâm thần để được chẩn đoán chính xác và điều trị thích hợp. "
Khàn tiếng người già,"Liệt thanh âm một bên chiếm 90% các trường hợp liệt thanh quản. Liệt dây thanh một bên có thể do nhiều nguyên nhân: do bản thân dây thần kinh điều khiển vận động của các cơ tham gia vào sự vận động của dây thanh âm, có thể do các nguyên nhân khác như viêm siêu vi, chấn thương, viêm khớp, các khối u ở tại thanh quản. Về điều trị, có một số trường hợp do chấn thương nhẹ có thể tự phục hồi và phần lớn cần được khám ở bác sĩ chuyên khoa để được điều trị thích hợp. Vì vậy, bạn nên đưa bà của bạn đến các bệnh viện chuyên khoa tai mũi họng để được khám đầy đủ. "
Quyến rũ đôi mắt,"Mùa cưới đến gần, bạn sẽ có dịp dự nhiều buổi tiệc. Một phong cách ứng dụng nhưng cũng không kém phần ấn tượng, điểm nhấn của gương mặt sẽ được tập trung vào đôi mắt, sau khi đánh nền mặt kỹ và tạo khối bằng highlight. Chân mày: chải bột nâu tự nhiên, không tỉa mỏng. Môi: dùng son có chất dưỡng ẩm, màu hồng phấn hoặc màu cam tươi. Mắt: Bạn có thể chọn màu mắt theo 1 trong 3 cách gợi ý sau đây. Người mẫu: BÍCH CHI Trang điểm: ÐÌNH NHƠN"
Chữa “trục trặc chuyện ấy” ở đâu?,"Như mọi thứ bệnh khác, điều trị triệu chứng thường dễ hơn là điều trị bệnh. Bất lực, hay yếu sinh lý, hay gọi là RLC theo y học (chắc để tránh gây mặc cảm cho bệnh nhân) chỉ là triệu chứng của một bệnh mạch máu, thần kinh ngay tại chỗ, hay do một bệnh toàn thân như tiểu đường, do dùng thuốc an thần... Bằng liệu pháp tâm lý hay gọi nôm na là tư vấn, bằng các thuốc uống, thuốc tiêm ngay tại chỗ, bằng ống hút hay bằng phẫu thuật trên mạch máu, và bí thế nữa thì còn phẫu thuật đặt thể hang giả, Tây y có thể điều trị hết triệu chứng này, nhưng để điều trị hết hẳn nguyên nhân gây bệnh thì không dễ chút nào. Điều trị để trở lại như xưa là rất khó, nhưng để “cần là được” thì nằm trong tầm tay của y học hiện nay nhờ một số thuốc uống mới ra đời từ năm 1998 như sildenafil, vardenafil, tadalafil. Các thuốc này không phải là thuốc kích dục vì chúng không đem tới sự hưng phấn tình dục. Bệnh nhân phải có ham muốn tình dục bình thường thì dùng chúng mới có hiệu quả. Sau khi dùng thuốc, phải chờ một lát cho thuốc ngấm (60 phút đến 4 giờ đối với sildenafil, 16 phút đến 36 giờ đối với tadalafil), thuốc sẽ phát huy tác dụng. Ông có thể đến các phòng khám nam khoa ở các bệnh viện hoặc có thể đến Bệnh viện Bình Dân, số 371 Điện Biên Phủ, Q.3 - TPHCM, hay các cơ sở tư vấn tình dục học có uy tín để được hướng dẫn cụ thể. "
Chua miệng,"có thể đó là triệu chứng của lưỡi bị viêm mà nguyên nhân thường do nấm hoặc một số tác nhân nào đó. Để xác định nguyên nhân, bạn cần làm xét nghiệm nước bọt hoặc phết họng. Các nốt thịt tròn mọc ở hai bên thành lưỡi có thể là những tổ chức lymphô ở lưỡi phì đại do hiện tượng viêm kéo dài. Triệu chứng chua miệng cũng có thể là một biểu hiện của tình trạng nhiễm trùng tại lưỡi. Bạn nên đến Khu Điều trị - Bộ môn Bệnh lý miệng của Khoa Răng Hàm Mặt - Đại học Y Dược TPHCM xin khám và chữa trị. "
Đối tượng nguy cơ tiểu đường cao," Các đối tượng sau đây cần được thử đường huyết ở tuổi trước 45 tuổi, và vào các thời điểm gần nhau hơn: mập mạp (cân nặng &gt; 120% cân nặng lý tưởng), có người trực hệ trong gia đình bị đái tháo đường, thuộc sắc dân có nguy cơ cao (da đen, da đỏ, châu Á), đã sinh con có cân nặng lúc sinh &gt; 4 – 4,5 kg hay đã được chẩn đoán tiểu đường trong thai kỳ, bị cao huyết áp (huyết áp ³ 140/90 mmHg), có HDL cholesterol 35 mg/dl và/hoặc triglycerid ³ 250 mg/dl, đã được chẩn đoán là rối loạn đường huyết khi đói. Như vậy bạn đã có ít nhất 2 yếu tố nguy cơ, tuy bạn chưa đến lứa tuổi 45, nhưng bạn nên đến bác sĩ để tầm soát và đánh giá các yếu tố nguy cơ khác. Nếu hiện nay bạn không bị tiểu đường, thì sau đó ít nhất mỗi năm bạn nên đi khám bệnh một lần. Để có thể hạn chế khả năng mắc bệnh, bạn cần tránh có thêm những yếu tố nguy cơ khác như cần giữ mức cân đúng, ăn uống điều độ, tránh ăn quá mặn, giảm chất béo động vật, tăng cường vận động. "
5 lỗi trang điểm thường gặp ,"1. Màu viền môi quá đậm Màu chì thích hợp với màu son rất đậm. Nếu không, sẽ khiến đôi môi trông giả tạo, thô kệch. Tốt nhất là bạn nên có từng màu viền môi phù hợp với từng màu son. Nếu không, nên chọn một màu trung tính, thích hợp một cách tương đối với tất cả các màu son. 2. Bạn không dành đủ thời gian cần thiết để các lớp nền thẩm thấu vào da Thông thường khi trang điểm, để có một làn da hoàn hảo và mịn màng, bạn cần phải trang điểm thật kỹ với nhiều lớp phấn khác nhau. Nếu quá vội, những lớp giữ ẩm, phấn lót che khuyết điểm... sẽ không đuợc thẩm thấu tốt vào da, tạo ra từng lớp riêng biệt. Bạn cần lưu ý, khi đánh lớp kem giữ ẩm đầu tiên phải để chúng thẩm thấu vào da 10 phút truớc khi bôi những lớp khác. 3. Lớp che khuyết điểm quá mỏng Mục đích của lớp kem che khuyết điểm là để ngụy trang những vùng sạm da, mụn, sần sùi... Nếu bạn chọn lớp kem này có màu nhạt hơn so với da, sẽ không mang lại hiệu quả gì. 4. Phấn hồng Nhiều người thường dùng màu phấn nâu để làm gọn khuôn mặt, hai bên gò má. Tuy nhiên, nếu không khéo, sẽ phản tác dụng. Màu hồng nâu quá đậm sẽ làm da bạn trông đen sạm đi. Phấn hồng nâu không phải thích hợp với tất cả loại da. Để đôi má thêm xinh xắn, bạn chỉ cần dùng phấn má hồng màu hồng nhạt, hồng cam... sẽ tạo được vẻ đẹp tự nhiên nhất. 5. Chọn màu trang điểm quá sáng Một số màu trang điểm quá tươi hay quá sáng chỉ thích hợp với một số dịp đặc biệt. Nếu đi với trang phục thường ngày, sẽ trở nên lố bịch. Bạn nên chọn những màu sắc trung tính nhẹ, nhạt và phải phù hợp với làn da."
Gàu mãn tính,"Hiện tượng gàu xuất hiện trên da đầu được xem như một bệnh lý, do tình trạng da đầu bị bong tróc bất thường, diễn ra nhanh và nhiều. Có nhiều nguyên nhân gây ra gàu như tăng tiết bã nhờn da đầu, thay đổi pH da đầu, vi nấm P. ovale tăng sinh và tế bào da đầu tăng trưởng quá nhanh. Ngoài ra, một số yếu tố khác cũng góp phần gây ra gàu, như: sử dụng dầu gội đầu không đúng cách, xả nước không sạch, dầu gội đầu có nhiều chất nhờn hoặc có chất tẩy rửa mạnh; tinh thần bị căng thẳng, lo lắng, stress, mất ngủ...; dị ứng mỹ phẩm dùng trên đầu như keo xịt tóc, thuốc nhuộm tóc; mất cân bằng nội tiết tố (người có tăng tiết androgen...). Để điều trị, chị nên thử thực hiện các biện pháp đơn giản áp dụng tại nhà như gội đầu đều đặn mỗi ngày với dầu gội đầu thông thường. Khi gội cần xoa bóp nhẹ nhàng và để dầu gội đầu thấm xuống da đầu trong 2 - 3 phút. Lưu ý phải xả nước thật sạch sau khi gội. Dầu gội đầu thông thường sẽ giúp duy trì sự cân bằng độ pH trên da đầu và giảm thiểu nguy cơ bị gàu. Ăn nhiều rau quả, trái cây tươi. Nếu không hết, có thể chuyển sang sử dụng dầu gội đầu thuốc có chứa các chất sau: selenium sulfide, pyrithione kẽm, hắc ín, ketoconazole, salicylic acid, lưu huỳnh. Khi dùng những loại này cần lưu ý một số điều sau: Mỗi lần gội nên gội 2 lần liên tiếp để đạt kết quả tối ưu, xoa nhẹ nhàng dầu thuốc trên da đầu để tạo bọt và để như vậy trong 5-10 phút. Nếu tóc trở nên khô trong khi đang điều trị gàu bằng một dầu gội đầu thuốc, thì nên thay bằng dầu gội đầu thuốc khác hay dùng thêm dầu xả sau mỗi lần gội đầu. Sau khi đã hết sạch gàu, nên tiếp tục duy trì dầu gội đầu thuốc một thời gian nữa (2 - 3 tuần) để ngăn chặn tái phát sau điều trị. Ngoài ra, nên dùng thêm một số loại vitamin nhóm B như B6, bepanthene, biotine, vitamin A, beta carotene, dầu gan cá, vitamin E, kẽm, cystin, lecithin... để giúp ích cho tóc và da đầu. "
Ăn uống khi bị "xót dạ dày"," “Xót dạ dày” chỉ là một triệu chứng. Muốn xác định bệnh gì, bạn nên đi khám thêm, nếu cần bác sĩ sẽ đề nghị bạn chụp phim dạ dày hoặc nội soi để biết rõ bệnh. Hiện tại, bạn nên hạn chế các món ăn chua, cay, cứng hoặc rau sống, ăn uống đúng giờ giấc. "
Màu da tự nhiên,"Ðể phù hợp với xu hướng trang điểm gương mặt sao cho thật tự nhiên, bạn có thể chọn các màu cùng tông với màu da. Nền : sử dụng phấn màu da hơi có sắc vàng Lông mày : màu nâu kẻ nhẹ nhàng Má : màu hồng ngả đất đánh vát hai bên Mắt : xung quanh mắt dùng màu mắt màu kem trắng, viền mí trên bằng màu mắt nước đen, nhấn màu vàng cho bầu mắt phía trên. Môi : chọn màu cam đánh nhẹ sau đó là thoa lên một lượt son bóng"
Ngón tay nhạy cảm,"đó là bệnh cảnh của hiện tượng Raynauds. Đó là tình trạng tổn thương mạch gây co thắt các mạch máu nhỏ ở các đầu chi, bệnh thường liên quan đến các bệnh về mô liên kết như xơ cứng bì, viêm bì cơ, lupus đỏ, viêm khớp dạng thấp... Triệu chứng trên có thể xuất hiện nguyên phát không kèm theo các bệnh về mô liên kết, gọi là bệnh Raynauds. Để tìm ra nguyên nhân cụ thể nhằm có hướng điều trị chính xác và hiệu quả, bệnh nhân cần đi khám và thực hiện một số xét nghiệm tại các trung tâm chuyên khoa da liễu. Ngoài việc sử dụng các nhóm thuốc giãn mạch dưới chỉ định và theo dõi chặt chẽ của bác sĩ chuyên khoa, bệnh nhân cần thực hiện một số biện pháp sau: Tránh tiếp xúc với nước lạnh, không chỉ tại chỗ mà cả toàn thân vì các đầu chi vẫn có thể bị ảnh hưởng bởi hiện tượng này. Mang vớ giữ ấm. Tắm nước nhiệt độ khoảng 43 o C. "
Các loại thuốc bổ thận tráng dương dễ kiếm,"Tắc kè: được xem là bổ ngang với nhân sâm; vị mặn, tính ôn, có tác dụng chữa hen suyễn, lao phổi, bổ thận, tráng dương, cường tinh. Đuôi tắc kè là bộ phận quý nhất. Các nghiên cứu cho thấy, đuôi tắc kè chứa nhiều chất béo với một tinh thể đặc biệt chưa rõ hoạt chất. Động vật này cũng có nhiều axit amin, giúp chống mệt mỏi. Thuốc chế từ tắc kè có thể chống vi khuẩn gram dương và gram âm; không gây dị ứng, kích thích sự tăng trưởng, tăng hồng cầu, tăng huyết sắc tố và không ảnh hưởng tới hệ bạch cầu. Kinh nghiệm dân gian giúp thử để biết tắc kè thật hay dởm: đem nướng vàng tắc kè, giã nhỏ, ngậm một ít vào lưỡi, chạy một quãng đường không phải thở mệt thì đó là tắc kè thật. Chế biến và sử dụng: Tắc kè được mổ bụng, bỏ hết ruột, dùng que căng hai chân trước, 2 chân sau và 1 que xuyên suốt từ đầu đến đuôi, đem phơi hoặc sấy khô. Đuôi được quấn chặt bằng giấy bản để bảo vệ. Khi dùng bỏ mắt, chặt 4 bàn chân, sấy thật khô, tán nhỏ viên thành hoàn hoặc đem ngâm rượu. Mỗi ngày dùng 3-4 g. Trong sinh hoạt tình dục, tắc kè giúp kéo dài, chống hoạt tinh và chống mệt mỏi. Cá ngựa Sống chủ yếu ở nước mặn, có đầu giống đầu ngựa, thân dài 15-20 cm, có khi tới 30 cm, có nhiều màu khác nhau nhưng theo kinh nghiệm dân gian thì trắng và vàng tốt hơn cả. Ở Trung Quốc, cá ngựa được xem là loại thuốc quý, kích dục cho nam giới (bổ thận, tráng dương). Đối với nữ, nó chữa đau bụng, suy mòn, thiếu máu sau sinh đẻ và có tác dụng đối với những người đẻ khó. Theo y học cổ truyền, cá ngựa tính ôn, vị ngọt, không độc, có tác dụng bồi bổ cơ thể, dễ dùng. Ngày dùng 4-12 g dưới dạng thuốc sắc hoặc bột, chia làm 3 lần, mỗi lần 1-3 g chiêu với rượu. Sau khi bỏ ruột, uốn đuôi cho cong đem phơi hoặc sấy khô, người ta thường buộc thành cặp 2 con, xem đó là một đực và một cái; nhưng thực ra là không đúng vì không phân biệt được đực hay cái. Cẩu thận Thực chất, cẩu thận là dương vật và tinh hoàn của chó chứ không phải là thận chó. Theo y học cổ truyền, cẩu thận vị mặn, tính đại nhiệt, có tác dụng tráng dương ích khí, dùng cho người liệt dương, di tinh, đau lưng, mỏi gối. Các nghiên cứu gần đây còn cho thấy trong cẩu thận có nội tiết tố nam (androsteron), protit và chất béo... đều là những chất bồi bổ hiệu nghiệm cho nam giới. Chế biến và sử dụng: Lấy toàn bộ dương vật và tinh hoàn chó, đem sấy khô, tán thành bột hoàn thành viên hoặc đem ngâm rượu. Mỗi ngày dùng 4-12 g"
Bệnh tiểu đường,"Tiểu đường là gì ? Tiểu đường là xuất hiện đường trong nước tiểu ( bình thường không có), làm cho nước tiểu có vị ngọt. Ðây là bệnh lý nội khoa mãn tính, có mức đường tăng bất thường trong máu. Ðường trong máu tăng làm xuất hiện đường trong nước tiểu. Bình thường, đường trong máu được kiểm soát bằng insulin, là một nội tiết tố của tuyến tuỵ. Insulin có tác dụng làm giảm đường trong máu. Khi đường máu tăng ( chẳng hạn sau khi ăn), insulin sẽ đưa mức đường huyết trở về bình thường. Ở người bị tiểu đường do sự sản xuất insulin không đủ, đó là nguyên nhân làm tăng đường huyết. Tiểu đường là một bệnh lý mãn tính ảnh hưởng đến cuộc sống người bệnh. Về lâu dài, bệnh tiểu đường có thể gây tổn thương mạch máu, thần kinh, suy thận. Bệnh tiểu đường cũng là một yếu tố nguy cơ quan trọng làm tăng tình trạng xơ vữa động mạch, đột quị, bệnh mạch vành tim và gây ra các bệnh lý mạch máu khác trong cơ thể. Bệnh tiểu đường chiếm tỷ lệ khá cao và tỷ lệ thuận với tình trạng dinh dưỡng. Có rất nhiều người bị bệnh tiểu đường mà không hề hay biết. Chi phí trực tiếp và gián tiếp cho điều trị bệnh tiểu đường cũng khá cao, vì bệnh tiểu đường phải điều trị suốt đời. Tử vong do bệnh tiểu đường đứng hàng thứ ba sau bệnh tim và ung thư. Nguyên nhân nào gây ra bệnh tiểu đường? Bệnh tiểu đường loại 1 là do thiếu insulin. Do tuỵ sản xuất không đủ insulin ( thiếu insulin tương đối hay tuyệt đối so với nhu cầu của cơ thể ) hoặc do tế bào không sử dụng được insulin, làm tăng đường huyết và tiểu đường. Thường bị ảnh hưởng nhất là tế bào cơ và mô mỡ, kết quả của quá trình này được gọi là  kháng insulin. Kháng insulin là vấn đề chính trong bệnh tiểu đường loại 2. Glucose là loại đường đơn có trong thức ăn. Glucose là chất dinh dưỡng chính cung cấp năng lượng cho các tế bào trong cơ thể hoạt động. Sau khi ăn, thức ăn được tiêu hoá ở dạ dày và ruột. Sau khi ăn vào, glucose trong thức ăn sẽ được hấp thu ở ruột bởi những tế bào của ruột, sau đó nó được vận chuyển trong máu đi đến các tế bào của cơ thể. Tuy nhiên glucose không thể vào trong tế bào một mình được, mà nó phải nhờ đến insulin để đưa vào trong tế bào. Nếu không có insulin, tế bào không sử dụng được năng lượng từ glucose, và như vậy làm cho nồng độ glucose trong máu tăng. Làm cho glucose bị thải nhiều qua nước tiểu. Insulin là một nội tiết tố được tế bào đặc biệt của tuyến tuỵ bài tiết ra. Nó có tác dụng giúp đưa glucose vào trong tế bào, cũng như insulin giữ vai trò quan trọng trong việc điều hòa glucose máu. Tuỵ là một cơ quan nằm sâu trong bụng, phía sau bao tử . Sau khi ăn, glucose trong máu tăng lên. Ðể đáp ứng với sự tăng này, tuỵ sẽ bài tiết ra insulin giúp đưa glucose vào trong tế bào và như thế sẽ làm mức đường trong máu trở về bình thường. Khi glucose trong máu thấp, tuỵ sẽ ngưng bài tiết insulin. Ở người bình thường, với hệ thống điều hoà như vậy giúp kiểm soát được mức đường trong máu. Còn ở bệnh nhân bị tiểu đường, chất insulin bị thiếu hụt ( tiểu đường loại 1) hoặc bài tiết không đủ cho nhu cầu của cơ thể ( tiểu đường loại 2 ). Cả hai nguyên nhân này đều làm tăng lượng đường trong máu."
Móm xương và chỉnh nha ," Kết quả chỉnh nha tùy thuộc vào bệnh nhân bị móm xương nhiều hay ít. Ở tuổi 32, bạn vẫn có thể chỉnh móm xương được, thời gian điều trị tùy vào mức độ móm nhiều hay ít. Bạn có thể liện hệ với Bệnh viện Răng Hàm Mặt TPHCM hoặc các cơ sở nha khoa có uy tín để được điều trị ngoài giờ hành chánh. "
