question,answer
Lé không thường xuyên," Vì chỉ lé từng lúc nên có thể chưa ảnh hưởng tới các chức năng mắt. Trường hợp này chỉ có cách điều trị duy nhất là mổ chỉnh cơ để 2 mắt thẳng lại. Riêng trường hợp con ông đã đi khám, có lẽ các chức năng mắt của cháu còn tốt nên bác sĩ không chỉ định điều trị về chức năng và phẫu thuật. Điều trị cho cháu chỉ là tập quy tụ mắt hằng ngày để kiểm soát độ lé, ngăn ngừa lé tiến triển, hẹn tái khám từ 4-6 tháng một lần để kiểm tra lại tình trạng mắt. Việc quyết định mổ chỉnh lé hay không phụ thuộc vào việc lé có ảnh hưởng trên chức năng mắt hoặc chờ khi bé trên 10 tuổi (vì khi đó mổ chỉnh lé chỉ chích tê tại mắt, còn dưới 10 tuổi mổ lé cần gây mê toàn thân, nên chỉ quyết định mổ lé cho trẻ dưới 10 tuổi khi thật cần thiết). Theo tôi, ông nên cho cháu tuân thủ chế độ điều trị, đi tái khám đúng hẹn và nếu có thắc mắc về tình trạng lé của cháu nên hỏi trực tiếp bác sĩ điều trị để được trả lời cụ thể. "
Người bị tiểu đường cẩn thận khi mang dép," Đối với những người bị tiểu đường, mang giày dép không thích hợp làm tăng nguy cơ phải cắt cụt chi. Tỉ lệ cắt cụt chi nói chung ở người bị bệnh tiểu đường là 936/10.000 bệnh nhân, trong đó đàn ông và người độc thân có nguy cơ cao hơn những đối tượng khác.Theo nghiên cứu của các nhà khoa học thuộc Đại học West Indies (Barbados), nguy cơ cắt cụt chi tăng gấp 3 lần ở những đàn ông không mang giày dép, 2 hoặc 4 lần ở phụ nữ thường xuyên mang giày đế mềm đi làm hay ra phố, 2 lần ở những người mang dép tông và 4 lần ở những người mang giày dép thời trang. Các nhà nghiên cứu nhấn mạnh sự cần thiết phải cải thiện chất lượng giày dép, đặc biệt là giày dép cho người bị tiểu đường, cũng như các dịch vụ chữa bệnh và phẫu thuật chân. "
Da kích ứng,"Mụn cám thường xuất hiện ở những người độ tuổi 20 có da nhờn. Hiện tại da mặt của bạn khô, bong vẩy, ngứa, xuất hiện nhiều mụn viêm là có thể do bạn sử dụng sữa rửa mặt không đúng cách hoặc dùng kem không rõ nguồn gốc gây dị ứng. Những mụn đỏ mới có trên da mặt bạn là mụn trứng cá viêm. Việc điều trị cần phải qua nhiều bước, vì thế bạn nên đến bệnh viện có chuyên khoa da liễu để được điều trị kịp thời và hiệu quả. Trước mắt, để tránh da bị nám hoặc có sẹo, bạn có thể thực hiện những sự chỉ dẫn sau: Ngưng sử dụng các sản phẩm trị mụn, sữa rửa mặt không rõ nguồn gốc. Tránh massage mặt khi da bị dị ứng và có mụn trứng cá. Tránh tiếp xúc với ánh nắng mặt trời. Tránh cào gãi, nặn mụn. Sử dụng nước ấm khi rửa mặt để cải thiện tình trạng ngứa. Có thể dùng kèm theo các sản phẩm rửa mặt làm ẩm da không có chất xà phòng và uống kèm thuốc kháng dị ứng. "
Dùng thuốc cao huyết áp lâu ngày,"Điều trị cao huyết áp là một điều trị toàn diện, bao gồm điều trị không dùng thuốc (thay đổi lối sống, hạn chế rượu, bia, thuốc lá, hạn chế ăn mặn, vận động thể lực mỗi ngày tối thiểu 30 phút...) và dùng thuốc. Thông thường khi điều trị không dùng thuốc mà không hiệu quả, huyết áp chưa đạt mục tiêu, thì bác sĩ mới cho bệnh nhân dùng thuốc. Thuốc chữa cao huyết áp gồm nhiều nhóm khác nhau. Thuốc Zestril (chứ không phải Zetril) là biệt dược của nhóm ức chế men chuyển Lisinopril, được con người phát hiện hơn 100 năm và sử dụng từ gần 30 năm nay. Thuốc dùng tương đối an toàn và hiệu quả ở bệnh nhân có sự theo dõi của bác sĩ. Trong nhiều thử nghiệm lớn, người ta đã cho bệnh nhân sử dụng Zestril đến 5 năm. Tuy nhiên, Zestril cũng có thể gây ra những tác dụng phụ như ho, tụt huyết áp, phù, dị ứng, tăng kali máu, ảnh hưởng đến thai... Theo tôi, bạn nên đưa má đi kiểm tra sức khỏe định kỳ để bác sĩ đánh giá hiệu quả điều trị, tránh các tác dụng và tương tác thuốc có thể xảy ra."
Bóng đè,"hiện tượng rối loạn giấc ngủ dạng ngủ không sâu. Vì không mô tả kỹ nên không biết là cháu có hay gặp ác mộng mỗi đêm không. Cháu có thể thử áp dụng vài biện pháp vệ sinh giấc ngủ như không sử dụng trà, cà phê vào buổi chiều, tắm nước ấm khoảng 20 phút trước khi ngủ, không nên ngủ nhiều ban ngày, tránh ăn quá nhiều hay những loại đồ ăn khó tiêu trước khi ngủ... Nếu mọi chuyện vẫn không cải thiện thì cháu nên xin gia đình cho đi khám bác sĩ chuyên khoa tâm thần để có hướng điều trị thích hợp. "
Trang điểm trong đêm Giáng sinh,"1. Vẻ đẹp mang sắc màu hội họa Với kiểu trang điểm này, điểm nhấn nằm ở đôi mắt với những màu sắc rực rỡ, lung linh từ lông mi cho đến lông mày. Những loại phấn nhũ thường không bám tốt và để những màu sắc lấp lánh được giữ lâu hơn, bạn có thể cho một lớp vaseline trước khi sử dụng phấn màu. Bước tiếp theo là tạo nên hàng lông mi đầy màu sắc. Bạn cần bôi một lớp mascara, loại mascara trong suốt (MAC Pro Lash) để tạo một lớp nền lý tưởng trên đó bạn có thể sử dụng thêm nhiều màu sắc khác nhau. Để làm nổi bật gò má, bạn chỉ cần dùng một lớp kem Giorgio Armani và sản phẩm còn có thể được dùng để đánh một lớp ngoài cùng cho toàn bộ khuôn mặt. 2. Vẻ trang trọng và duyên dáng Những sắc màu tinh tế và một sắc đỏ hây hây trên khuôn mặt tươi tắn là những nét đặc trưng của kiểu trang điểm này. Trong kiểu trang điểm này, một lớp phấn nền hoàn hảo là hết sức quan trọng. Hãy sử dụng loại phấn nền tốt nhất được kết hợp với cả phấn che và các thành phần chống lão hóa với những thành phần khuếch tán ánh sáng và còn có vai trò như một sản phẩm dưỡng da. Sản phẩm cuối cùng cần cân nhắc là son môi. 3. Vẻ đẹp tự nhiên Khi sử dụng những màu sắc sáng, mạnh, những màu sắc trung tính, bạn phải phụ thuộc rất nhiều vào sự tinh tế của màu sắc và kết cấu bên trong của các sản phẩm. Bạn lại thường xuyên sử dụng màu sắc trung tính nhiều hơn là màu sắc sặc sỡ. Trong kiểu trang điểm này, màu bơ được sử dụng trên mi mắt để tạo độ sâu và màu đỏ tía được sử dụng để kẻ đường viền cho mắt. Đối với đôi môi, bạn cũng phải chọn một màu sắc trung tín. Tuy nhiên bạn cũng có thể làm nổi bật đôi môi bằng những loại son nước bóng. Cây chì kẻ môi là một sản phẩm bạn nên cân nhắc. Tránh màu đậm do dó không thích hợp với màu sắc trung tín bạn đã chọn cho đôi môi."
Để có đôi mắt đẹp,"Xông hơi mắt: Lấy một ít hoa cúc khô hoặc nhúng hai túi trà đun sôi với nước cho tinh chất hòa tan ra, đổ vào một cái chậu nhỏ vừa đủ, ghé mặt vào cách khoảng 30 cm, trùm khăn tắm lên đầu để hơi nước xông lên mặt. Xông khoảng 5 phút, mở to mắt cho nước mắt trào ra, giúp thông tuyến lệ. Sau đó lấy khăn khô lau chậm, nhẹ (nhớ không chà sát). Nên ngồi nghỉ ngơi ở nơi thoáng gió, tránh trang điểm trong vài giờ. Đắp mặt nạ: Có thể làm giảm quầng thâm bằng các loại mặt nạ. Có nhiều loại mặt nạ trên thị trường, nhưng mặt nạ bằng dưỡng chất rau quả tự làm có thể có tác động rất hiệu quả. Chẳng hạn trộn quả bơ và sữa tươi thành một hỗn hợp sệt đắp lên mắt. Thành phần hỗn hợp này sẽ giúp vùng da thâm trũng dưới mắt căng lên và nhạt màu đi. Đắp dưa chuột: Nếu không có nhiều thời gian, chỉ cần băm nhỏ quả dưa chuột rồi đắp quanh mắt, giữ trong khoảng 15 phút và thư giãn. Nếu như trong thực đơn hằng ngày có đủ lượng vitamin C, E, A, Betacaroten, ta sẽ không lo lắng nhiều về nguy cơ giảm thị lực. Giữ gìn đôi mắt &gt; Tránh tình trạng căng thẳng tư duy, cố gắng ngủ đủ giấc, bảo đảm chế độ dinh dưỡng tốt, giữ gìn đôi mắt và vùng da mỏng manh quanh mắt... Tất cả những việc đó giúp ta tránh được sự lão hóa sớm và ngăn cản sự xuất hiện nếp nhăn ở vùng mắt. &gt; Mí mắt mọng là do hiện tượng trữ nước hay một số nguyên nhân khác như thiếu ngủ hoặc ngủ quá nhiều, bị stress hoặc do tích mỡ dưới mí mắt. Vì thế, không nên uống hoặc ăn nhiều rồi đi ngủ ngay. Đừng thoa các loại kem lạ lên da hay thoa quá đậm đặc vì chúng có thể làm các mô quanh mắt bị phồng lên. Đắp túi bã chè lên mắt, chất axit tannic có hiệu quả phục hồi mắt rất tốt (cũng có thể đắp bằng những lát dưa chuột), hoặc đắp miếng gạc lạnh trên mắt cũng làm giảm đi sự mệt mỏi cho mắt. &gt; Quầng thâm quanh mắt xuất hiện khi ta không ngủ đủ giấc. Làn da mệt mỏi xung quanh mắt bị mất tính đàn hồi, khiến mí mắt bị xệ. Các tế bào máu đỏ dẫn tới vùng da quanh mắt bị hiện rõ ra vì da ở đây quá mỏng, làm cho da trở nên đậm màu hơn các vùng da khác. Ngoài ra, mí mắt thâm quầng có thể do di truyền. Cách tốt nhất vẫn là cần có một chế độ nghỉ ngơi điều độ và hợp lý. &gt; Khi mua mỹ phẩm cho mắt, nên tránh loại có chứa cồn và hương thơm. Chỉ bắt đầu trang điểm khi mặt và mắt đã được rửa sạch, cố gắng không để chệch tay, phải xoa đi xoa lại, vừa không còn chính xác, vừa rất mau tổn thương và làm hằn nếp nhăn cho mắt. &gt; Khi máy vi tính hoạt động, màn hình sẽ phát ra tia bức xạ. Khi làm việc với máy vi tính nên ngồi cách xa màn hình ít nhất 30 cm (với màn hình 14 inch) và 40 cm (với màn hình 17 hay 20 inch). Nên điều chỉnh màn hình để mắt không phải hướng lên điều tiết nhiều, cứ mỗi giờ nên rời mắt khỏi màn hình 5 - 10 phút."
Bí quyết tạo nền khi trang điểm,"Bạn không nên dùng mu bàn tay, gò má, mũi hay trán làm bảng thử màu cho kem nền. Khu vực lý tưởng giúp bạn thử màu nền là vùng da cổ, dưới tai. Đây là vùng có màu hồng tự nhiên, mềm mại và ít bị đốm đen như da tay. Khi thoa kem nền, chúng sẽ cho màu sắc trung thực nhất. Khi chọn kem có khả năng bắt sáng, đừng lầm tưởng độ bắt sáng với sự nhờn rít của kem nền. Độ bắt sáng là khi thoa kem nền, da bạn bóng nhẹ nhưng không nhờn. Ngược lại, khi kem nền tạo lớp nhờn dầu trên da, bạn không nên tiếp tục sử dụng loại này. Hãy chọn kem nền dạng lỏng chứa nhũ mịn hay loại có khả năng hấp thu ánh sáng. Bạn sẽ dễ tạo lớp nền mỏng, trong suốt, mang lại cho làn da sự mềm mại, mịn màng, căng bóng và trẻ trung. Hãy nhớ rằng lớp kem lót vô cùng quan trọng. Đừng quên thoa lớp kem lót dưỡng da trước khi thoa kem nền. Chúng tạo lớp màng bảo vệ da, chống lại ảnh hưởng từ các loại mỹ phẩm khác. Hãy thoa kem dưỡng khoảng 5 phút trước khi đánh kem nền để chất dinh dưỡng có thời gian thẩm thấu hoàn toàn vào da. Sau khi thoa, nên dùng tay vỗ nhẹ lên da giúp kem thấm nhanh chóng hơn. Bạn đừng thoa kem nền gói gọn trong khuôn của gương mặt vì sẽ tạo cảm giác đang đeo mặt nạ, làm gương mặt tách biệt hẳn với cổ; nhưng cũng đừng thoa kem nền bọc kín cả cổ. Nên thoa kem nền tận xuống hàm và cứ thế tán nhạt dần xuống dưới cổ cho đến khi mất hẳn đường ranh giới giữa mặt và cổ. Không nên dùng một loại kem nền duy nhất cho tất cả các mùa trong năm. Sự ảnh hưởng của thời tiết sẽ khiến da thay đổi rất rõ nét. Nên có ít nhất hai loại kem nền. Mùa nắng, da rất dễ đổ mồ hôi, bạn nên chọn loại lem nền oil-free (không chứa dầu) để tránh tình trạng bít kín lỗ chân lông, khiến da bị ''nghẹt thở''. Mùa lạnh, da thiếu nước, khô nẻ, bong tróc; hãy chọn kem nền chứa chất dưỡng, giúp da mềm mại. Đừng thoa kem nền như trát vôi vữa lên tường. Miếng mousse mềm khó có thể giúp bạn tán mỏng kem trên da. Cách này cũng làm hao phí một lượng kem đáng kể vì chúng thấm vào miếng mousse mỗi khi bạn tán mỏng kem ra. Hãy thay thế miếng mouse bằng những ngón tay của bạn. Lấy một lượng kem nền vừa đủ, chấm lên những vùng trọng điểm của gương mặt như trán, đầu mũi, hai má, cằm. Tiếp đến, lấy phần bụng ở đầu ngón tán kem thật mỏng, đều lên da. Sự tiếp xúc giữa các ngón tay và da mặt sẽ giúp bạn dễ kiểm soát lượng kem tán trên da đầy đủ, đều hay chưa. Chú ý: Luôn thoa kem theo hướng ra ngoài. Bạn không nên thường xuyên dùng kem nền không thấm nước (waterproof) trừ những khi đi biển hay bơi lội. Chúng bám rất chắc vào da, bít kín các lỗ chân lông. Điều này sẽ gây bất lợi cho bạn trong quá trình tẩy trang. Thay vì dùng kem nền không thấm nước, bạn chỉ cần dùng loại thông thường. Tuy nhiên, khi trang điểm, nên dùng đầu ngón tay miết nhẹ kem sát vào da, lớp kem nền sẽ bền hơn."
Acid béo omega 3 và tim mạch," Sau khi nhồi máu cơ tim người ta nên hoạt động vừa sức, và luôn đặt dưới sự theo dõi, kiểm tra định kỳ của bác sĩ chuyên khoa. Việc quan hệ vợ chồng không có kiêng cữ. Acid béo omega 3, có trong dầu cải, cá, hải sản, rau quả lá xanh..., được cho là có khả năng làm giảm cholesterol xấu (LDL) trong máu, giảm kết tập tiểu cầu (một trong những nguy cơ tạo thành cục máu đông gây tai biến tim mạch), điều hòa nhịp tim... Tuy nhiên, những khả năng này vẫn còn tranh cãi, chưa được sự công nhận của tất cả mọi người. "
Công dụng của chì,"Công dụng của chìChì trang điểm gồm có 7 loại: Chì chân mày, chì má hồng, chì viền mí, chì bóng mắt, chì viền môi, chì che khuyết điểm và son môi với kiểu dáng bút chì. Sau đây là công dụng của từng loại Có 3 màu thông dụng: Đen, nâu và trắng. Chì trắng chỉ dành cho mí dưới, có tác dụng làm mắt trông to hơn. Chì mềm sẽ giúp bạn thao tác nhẹ nhàng hơn. Chì bóng mắt Trong trường hợp trang điểm nhanh, bạn có thể dùng chì bóng mắt thay thế phấn mắt. Chấm chì trên mí mắt rồi dùng ngón tay tản mỏng màu. Chì chân mày Dùng để tạo dáng cho chân mày. Tán đầu chì theo khung mày tự nhiên, bắt đầu từ đầu đến đuôi chân mày. Thực hiện theo chiều lông mày mọc, tán chì từ từ để kiểm soát độ đậm nhạt theo ý muốn. Chì che khuyết điểm Giúp bề mặt da trông láng mịn, không tỳ vết. Bạn có thể chấm chì trực tiếp trên các đốm mụn, tàn nhang... Chì che khuyết điểm có nhiều màu: Đỏ, vàng, kem, xanh... Bạn có thể chọn màu tùy theo màu của vết khuyết điểm và sắc da riêng của mỗi người. Chì má hồng Tô chì lên vùng má, rồi dùng đầu ngón tay tán đều màu ra. Má hồng dạng chì còn có thể dùng son môi. Chì viền môi Giúp vành môi sắc nét hơn. Để bờ môi trông tự nhiên, bạn nhớ chọn chì viền môi cùng tông màu với son môi. Son môi Son môi được thiết kế theo kiểu dáng cây viết là dạng son nước, có độ bóng hoặc ảnh nhũ. Dạng son này rất được ưa chuộng do có chứa chất dưỡng môi, gam màu trẻ trung, đồng thời lại rất tiện dụng, vì bạn không cần thoa thêm son dưỡng môi hoặc son bóng."
5 quan niệm sai lầm trong chăm sóc da mặt,"Do đời sống nâng cao, việc làm đẹp ngày càng được nhiều phụ nữ quan tâm. Theo bác sĩ Trần Ngọc Ánh, giảng viên Trung tâm Đào tạo và Bồi dưỡng cán bộ y tế TPHCM, vẫn có nhiều người chưa hiểu biết đúng đắn trong về chăm sóc da. 1. Rửa mặt nhiều lần trong ngày sẽ tránh được mụn: SAI - Để loại bỏ bụi bẩn, giữ cho lỗ chân lông thông thoáng và sạch, các bác sĩ da liễu luôn đề cao việc giữ vệ sinh da. Mỗi ngày nên rửa mặt từ 2 - 3 lần, nhiều nhất là 4 lần tùy theo da khô hoặc nhờn. Vào mùa lạnh, da bị khô nên rửa mặt ít hơn. Không nên rửa mặt quá nhiều bởi bình thường da mặt có độ nhờn và trơn láng vừa phải, rửa nhiều da mặt sẽ khô. Lúc này, theo phản ứng tự nhiên của cơ thể, chất nhờn trên da mặt sẽ tiết bù lại để bảo vệ da và đôi khi còn được tiết nhiều hơn ban đầu. Trong khi đó, mụn trứng cá xuất hiện thường do nội tiết tố hoặc vi khuẩn, bụi bẩn, tế bào chết trên mặt da. Rửa mặt nhiều sẽ làm độ ẩm mất cân bằng và làm mụn nổi nhiều hơn. Để hạn chế sự xuất hiện của mụn, nên tẩy tế bào chết hoặc xông hơi mỗi tuần một lần. 2. Da nhờn không nên sử dụng kem giữ ẩm: SAI - Ngoài chức năng bảo vệ da không bị khô, kem giữ ẩm còn giúp da chống lại lão hóa. Người da nhờn có thể sử dụng sản phẩm chống nhờn, nhưng sau đó da khô quá thì nên nghĩ đến chuyện giữ ẩm da. 3. Uống nước nhiều giúp duy trì độ ẩm cho da: SAI - Độ ẩm của da là sự tổng thể của nhiều yếu tố, việc uống nước chỉ đóng vai trò một phần. Thời tiết hanh khô dễ gây mất nước hoặc càng lớn tuổi da càng khô. Ngoài ra, yếu tố căng thẳng, thức khuya, stress... cũng gây mất nước. Chế độ ăn mặn, ít rau quả cũng ảnh hưởng đến độ ẩm của da mặt. Vì vậy, ngoài việc uống nhiều nước cần cung cấp độ ẩm thường xuyên cho da bên cạnh chế độ sinh hoạt, chế độ dinh dưỡng hợp lý. 4. Mỹ phẩm sử dụng lâu không còn tác dụng: SAI - Thời gian đầu sử dụng mỹ phẩm sẽ có những thay đổi rõ rệt, nhưng khi da đã ổn định thì việc dùng mỹ phẩm lại mang ý nghĩa duy trì, vì thế vẫn nên sử dụng tiếp mỹ phẩm sau đó. Nếu chủ quan đã có làn da đẹp và ngưng sử dụng, dần dần da sẽ trở lại trạng thái cũ. Việc chăm sóc da đòi hỏi phải thường xuyên, lâu dài và ổn định. Không nhất thiết phải sử dụng một bộ sản phẩm nhưng cần lựa chọn loại mỹ phẩm phù hợp với làn da và duy trì trong khoảng thời gian nhất định. Lưu ý thời gian sử dụng sản phẩm tối đa là 2 năm, nếu quá hạn sẽ gây những phản ứng xấu cho da mặt. Với người có làn da nhạy cảm, nếu muốn thay đổi mỹ phẩm cần ngưng sử dụng trong vòng 4 tuần trước khi chuyển sang sử dụng loại mỹ phẩm mới. 5. Nặn mụn là cách tốt nhất xóa mụn: SAI - Cách tốt nhất để đối phó với mụn là thoa kem trị mụn khi chúng vừa mới xuất hiện. Việc nặn mụn bằng tay không thích hợp thời điểm (khi mụn còn nhỏ), dễ gây thủng da và để lại sẹo xấu, đồng thời chất bẩn và vi khuẩn sẽ bít lỗ chân lông làm mụn xuất hiện nhiều hơn. Đôi khi vì cố nặn mụn nên dẫn đến hiện tượng mặt bị sưng. Tuy nhiên, nếu mụn đã chín thì nên nặn để chúng không bị vỡ khi rửa mặt, dễ chảy máu và gây nhiễm trùng."
Làm đẹp với cọ trang điểm,"Cọ trang điểm là một dụng cụ làm đẹp phổ biến. Dùng cọ, việc trang điểm sẽ trở nên nhẹ nhàng, nhanh chóng và tiện lợi hơn rất nhiều, đồng thời mỹ phẩm cũng phát huy được hiệu quả hơn nhờ vào những cây cọ này. Thế giới cọ trang điểm cũng hết sức phong phú, mỗi loại cọ có một công dụng riêng. Bạn có thể tham khảo một số loại cọ thông dụng được dùng trong trang điểm sau đây để có thể chọn một mình vài loại phù hợp và cần thiết để làm đẹp. Cọ thoa phấn nền Đối với những loại phấn nền dạng lỏng, thay vì dùng miếng mút, bạn có thể dùng đến loại cọ này. Đầu cọ mịn giúp bạn chấm những chấm phấn nền nhỏ li ti lên mặt, miết nhẹ khắp vùng mặt. Nên bắt đầu chấm và thoa phấn từ vùng giữa mắt, chuyển dần sang hai bên má, xương quai hàm và lan đến vùng cổ. Ưu điểm của loại cọ này là giúp phấn nền tỏa đều khắp mặt và nhanh chóng thấm sâu vào da, đồng thời tiết kiệm được một lượng phấn đáng kể, không hút nhiều phần như mút. Cọ thoa phấn phủ Sau khi thoa phấn nền, bạn cần đến loại cọ này để phủ một lớp phấn mới lên bề mặt da giúp da trông mịn màng và tươi tắn hơn. Ưu điểm của loại cọ này là tan đều phấn khắp mặt, hạn chế tối đa việc phấn bám vào da không đều, chỗ dầy chỗ mỏng. Đầu tiên, bạn nhúng đầu cọ vào hộp phấn, gõ nhẹ cho phấn rơi bớt, sau đó từ từ thoa phấn lên mặt theo chiều từ trên xuống dưới. Cọ thoa phấn hồng Những sợi lông li ti và đều nơi đầu cọ sẽ giúp phấn hồng bám đều vào đầu cọ và lan tỏa đều trên vùng má, dễ dàng điều khiển đúng với ý đồ của người trang điểm. Trước khi thoa phấn má hồng, bạn nhờ gõ nhẹ để bụi phấn bay bớt, sau đó xoay trộn đầu cọ lên gò má rồi nhẹ nhàng kéo cọ xuống phía gần mang tai. Bạn cũng có thể thoa một ít phấn hồng lên sóng mũi, cằm và trán để khuôn mặt trở nên hồng hào ở mọi góc cạnh. Cọ kẻ mắt Đầu cọ loại này thường được thiết kế gọn, mạnh và cứng giúp cho việc pha màu và tán màu lên bầu mắt và mi mắt được đều, đồng thời cho độ phủ màu cao, tránh tạo nên những nếp nhăn do phấn bị đóng màng. Nên dùng cọ kẻ mắt từ đầu mắt đến đuôi mắt, nhớ thoa thật sát với đường kẻ mi. Cọ son môi Loại cọ này có cấu tạo cung cấp để hỗ trợ bạn trong việc pha màu môi ưng ý. Đầu cọ thường nhọn với những sợi lông nhỏ mịn, giúp thoa son vào môi dễ dàng, ăn son, đồng thời tránh lem màu ra ngoài vành môi. Phần dẹt của cọ giúp tán đều son và tạo độ mỏng cho làn môi. Cọ chải mi Cọ chải mi được sử dụng sau khi chải mascara nhằm tách mi, giúp mi không bị rối. Đồng thời, loại cọ này còn được sử dụng để chải lông mày. Bạn nên lau cọ bằng khăn lụa sau mỗi lần chải để màu khỏi bị lem. Dù cọ trang điểm được làm từ chất liệu gì và công năng ra sao thì chúng cũng cần được chăm sóc và giữ gìn. Nên giữ cho đầu cọ luôn sạch sẽ vì một chiếc cọ bạn có thể sẽ làm biến màu son hoặc màu phấn trang điểm của bạn. Sau mỗi lần sử dụng, bạn nên lau nhẹ cọ bằng giấy lụa hoặc gõ cho bay hết lớp phấn trang điểm vừa bám vào đầu cọ. Hàng tuần, nên tổng vệ sinh cọ bằng một ít dầu gội đầu dưỡng ẩm, xoa nhẹ đầu cọ, sau đó xả sạch và vảy hết nước rồi hong khô trong bóng râm."
