question,answer
Ngăn ngừa bệnh ung thư vú ở các lứa tuổi,"Sau những công trình nghiên cứu, các nhà khoa học đưa ra kết luận rằng cứ 8 người thì có một người bị mắc căn bệnh ung thư vú - bệnh được coi là một trong những bệnh đáng sợ nhất. Dưới đây là các phương pháp phòng ngừa ở từng lứa tuổi của người phụ nữ. 1. Lứa tuổi 20 Các nghiên cứu đã chỉ ra rằng cách phòng chống tự nhiên và có hiệu quả nhất đối với ung thư vú là nên có con sớm trong cuộc đời. Phụ nữ sinh con sớm (tuổi 20 hoặc ngoài 20) sẽ giảm nguy cơ bị ung thư vú là 50% so với phụ nữ không bao giờ sinh con. Bên cạnh đó, rèn luyện cơ thể cũng là một phương pháp phòng ngừa hiệu quả có thể giảm được 50% nguy cơ. Theo các nhà nghiên cứu thì quá trình tập luyện thường xuyên sẽ làm giảm lượng estrogen trong cơ thể người phụ nữ trẻ. Khi lượng estrogen này tích tụ dư thừa sẽ dẫn tới hình thành các u ở vú. Mỗi tuần rèn luyện cơ thể khoảng 4 giờ thì sẽ giảm nguy cơ ung thư vú là 50%. 2. Lứa tuổi 30 Tỉ lệ sinh đẻ đối với phụ nữ ở tuổi 30 tăng lên 2 lần trong 20 năm qua. Một đặc điểm là phụ nữ sau khi sinh thường lên cân rất nhanh, nếu lên tới khoảng 20 kg thì nguy cơ bị ung thư vú là 40%. Các tế bào mỡ cũng sản xuất ra ostrogen, và khi cơ thể tăng trọng lượng sẽ kích thích các khối u ở vú hình thành và phát triển. Hút thuốc lá cũng là tác nhân gây ung thư vú chiếm tỉ lệ là 60%. Để phòng chống, ngoài việc thường xuyên rèn luyện cơ thể và có chế độ ăn hợp lý, phụ nữ cần phải bổ sung lượng axit folic hằng ngày. 3. Lứa tuổi 40 Trung tâm nghiên cứu ung thư ở Bắc California - Mỹ khuyên rằng thường xuyên tắm nắng mặt trời sẽ giảm nguy cơ ung thư vú tới 40%. Chỉ cần mỗi ngày tắm nắng 10 phút có thể giúp bạn thu nạp vitamin D cần thiết. Ngoài ra ở lứa tuổi này chị em phụ nữ cũng cần thường xuyên đi chụp X- quang để sớm phát hiện khối u ở vú để từ đó có biện pháp điều trị kịp thời. Một nghiên cứu của Thụy Điển kết luận rằng việc thường xuyên chụp X-quang để phát hiện khối u có thể giảm nguy cơ tới 63%. 4. Lứa tuổi 50 Theo các bác sĩ chuyên khoa thì có tới 80% phụ nữ bị mắc bệnh ung thư ở lứa tuổi này. Chị em cần có chế độ ăn để không tăng cân, điều này sẽ giảm được nguy cơ gây bệnh. Liệu pháp thay thế hoocmon ở phụ nữ sau thời kỳ mãn kinh chỉ nên thực hiện trong một thời gian ngắn, nếu áp dụng liệu pháp này trong vòng 5 năm hoặc lâu hơn thì có thể tăng nguy cơ ung thư vú lên tới 70%. Những phụ nữ trong gia đình có tiền sử mắc bệnh ung thư vú thì không nên áp dụng liệu pháp này."
Làm đẹp cho khuôn mặt vuông,"Bạn có thể sử dụng kỹ thuật trang điểm kết hợp với kiểu tóc để tạo cho khuôn mặt hài hoà hơn. Nền: Dùng kem nền hơi sậm cho khuôn mặt và kem phấn nâu sậm để đánh vào hai góc cạnh của khuôn mặt. Dùng phấn màu sáng đánh ở trán, mũi và quầng mắt tạo độ sáng cho khuôn mặt. Cuối cùng phủ một lớp phấn. Chân mày: Chì đen tạo dáng chân mày cong nhẹ cho phù hợp với khuôn mătå. Má hồng: Dùng màu có ánh bạc đánh vát ở hai bên má. Môi: Vẽ một đường sắc viền bên ngoài bằng son, sau đó tô kín môi. Tóc: Cắt hơi tém ôm vào hai bên mặt tạo khuôn mặt thon thả hơn."
Làm đẹp bằng màu nước,"Hiện nay có các mỹ phẩm theo dạng nước để dùng trang điểm. Khi dùng loại mỹ phẩm này sẽ làm tăng sự gợi cảm cho khuôn mặt vì nó có pha nhũ. Nền: Dùng kem nước đánh nền để che các khuyết điểm trên mặt, sau đó phủ một lớp phấn như bình thường. Mắt: Đánh toàn bộ bầu mắt bằng mắt nước màu nhũ vàng. Nhấn mí mắt bằng màu vàng đồng cả mí trên và dưới. Ở cuối mắt tạo đuôi bằng màu nâu để mắt có chiều sâu và dài. Vuốt mascara tạo độ cong cho lông mi. Má: Đánh vát hai bên má. Môi: Dùng môi nước màu cam."
Một số nguyên nhân gây béo phì ,"Yếu tố di truyền: Qua nghiên cứu trẻ em sinh đôi thấy bệnh béo bị tác động của yếu tố di truyền đến 70%. Di thể (chromosome) của bệnh béo tìm thấy ở chromosome số 2, các di thể này ảnh hưởng và kiểm soát sự ham muốn ăn uống và sự tự đốt năng lượng của bộ phận cơ thể. Môi trường sinh sống: Bệnh béo ít khi xảy ra ở những điều kiện xã hội nghèo khổ thiếu ăn, mà thường phát triển trong môi trường ăn uống đầy đủ. Ðối với người già, cơ thể đốt năng lượng chậm và ít đi, thêm vào đó người già lại ít hoạt động do đó càng dễ bị béo ra; dễ bị béo phì nếu ăn uống tốt. Hoàn cảnh cô đơn, ít hoạt động cũng dễ làm bệnh béo phát triển. Có thai là một điều kiện có tác động khá mạnh gây béo ở một số phụ nữ. Mặc dầu phần lớn trọng lượng của phụ nữ chỉ tăng ít thôi mỗi năm sau mỗi lần sinh đẻ, cũng có tới khoảng 15% trọng lượng được tăng thêm sau mỗi lần có thai. Bệnh ở não như u ở não hoặc một nhiễm khuẩn ở não nhất là ở vùng dưới đồi (hypothalamus) cũng dễ gây béo ở một số người. Một số bệnh như nhược tuyến giáp, hội chứng Cushings' đều có khả năng làm tăng béo phì (&lt;1%). Thuốc: Một số thuốc cũng có khả năng làm tăng cân, đặc biệt các thuốc nội tiết có steroides và 4 loại lớn về thuốc hoạt động tâm lý như: thuốc chống trầm cảm, các thuốc benzodiazepin, lithium và thuốc chữa tâm lý. Bệnh béo phì liên quan tới một số bệnh khác như thế nào? Bệnh béo phì nếu không được chữa trị có khả năng gây nên một số bệnh nguy hiểm khác cụ thể: Có thể gây nên các bệnh như tiểu đường, tăng huyết áp, bệnh tim và nhồi máu cơ tim. Người béo phì dễ ngáy ngủ, thiếu ôxy lúc ngủ. Ðàn bà béo phì có nguy cơ cao bị ung thư vú và ung thư túi mật. Ðàn ông có tuổi béo phì có nguy cơ cao bị ung thư tuyến tiền liệt. Tỷ lệ ung thư đường ruột và bệnh sỏi mật, bệnh gan, bệnh về thực quản theo tài liệu y học thế giới đều tăng ở người bị béo phì. Người béo phì còn dễ bị bệnh thoái hóa các khớp xương như xương sống lưng, xương hông, háng. Tần suất phụ nữ bị béo phì nhiều hơn nam giới và chữa bệnh béo phì cũng như các biến chứng của bệnh cũng nhiều hơn nam giới. Hạn chế và chữa trị bệnh béo phì? Về ăn uống: Thành phần thức ăn nên có nhiều rau, nhiều chất xơ hơn các chất thịt, chất béo. Cách nấu nướng: Hấp, nướng hay luộc tốt hơn là chiên xào; hạn chế ăn vặt. Tập luyện thể dục: Hạn chế ăn uống phải đi đôi với tập luyện thể dục. Cố xây dựng nếp sống vận động thường xuyên trong gia đình, người hưu trí rỗi việc càng nên kiếm việc làm, hoạt động, tránh nằm nhiều rất có hại. Thuốc điều trị: Một số thuốc hiện có trên thị trường chỉ có tác dụng gây cảm giác không muốn ăn, làm mất nước, giảm cân chứ không có tác dụng trực tiếp làm tiêu hao được năng lượng. Một vài thuốc được dùng là: fenfluramin - phentermin, sibutramin. Các thuốc này dễ có phản ứng phụ tới tim mạch cho nên thận trọng khi dùng. Phương pháp ngoại khoa (Surgery): Người bị bệnh béo phì nặng (BMI&gt;40) hoặc bị biến chứng đe dọa tính mạng có thể sử dụng phương pháp phẫu thuật để chữa trị."
Phòng và trị viêm da mủ,"Bình thường trên da có nhiều tạp khuẩn, phần lớn là tụ cầu khuẩn và liên cầu khuẩn, tập trung nhiều nhất ở vùng có nhiều lông, vùng đọng mồ hôi như các nếp kẽ, các lỗ chân lông. Trong những điều kiện thuận lợi như cơ thể suy yếu, giảm sức đề kháng, vệ sinh kém, ngứa gãi làm xây sát da thì các vi khuẩn trên tăng sinh, tăng độc tính gây nên bệnh ngoài da gọi chung là viêm da mủ. Người ta thường phân chia làm 2 nhóm bệnh viêm da mủ, một nhóm do tụ cầu khuẩn, một nhóm do liên cầu khuẩn gây nên. Viêm da mủ do tụ cầu khuẩn Tụ cầu khuẩn thường gây tổn thương ở nang lông. Có những thể bệnh chính sau... Viêm nang lông nông: Viêm nông ở đầu lỗ chân lông. Ban đầu lỗ chân lông hơi sưng đỏ, đau, sau đó thành mụn mủ nhỏ, quanh chân lông có quầng viêm hẹp. Vài ngày sau, mụn mủ khô, để lại một vẩy tiết màu nâu sẫm. Sau cùng vẩy bong đi, không để lại sẹo. Viên nang lông sâu: Quanh nang lông sưng tấy nhiều cụm, quanh lỗ chân lông có mụn mủ. Mụn mủ có thể rải rác hoặc tập trung thành đám đỏ, cứng cộm, gồ ghề, nặn ra mủ. Viêm nang lông sâu ở vùng cằm, gáy, vùng da đầu tiến triển dai dẳng, hay tái phát. Ðiều trị: phải dùng kháng sinh toàn thân từng đợt, kết hợp với các vitamin, chế độ ăn nhiều đạm làm tăng sức đề kháng của cơ thể. Nhọt: Cũng là một tình trạng viêm nang lông. Nếu nhọt to, số lượng nhiều có thể kèm theo sốt, hạch bạch huyết sưng đau. Nhọt ở lỗ tai rất đau, dân gian còn gọi là đằng đằng. Nhọt ở quanh miệng còn gọi là đinh râu rất nguy hiểm vì có thể gây tắc tĩnh mạch, nhiễm khuẩn huyết dễ gây tử vong. Hậu bối còn gọi là đinh hương sen là một cụm đinh nhọt gặp ở gáy, lưng, mông do tụ cầu vàng có độc tính rất cao, hay gây bệnh ở người già yếu, nghiện rượu, tiểu đường, ăn uống kém. Khi vỡ mủ có nhiều ngòi lỗ chỗ như tổ ong, có thể có biến chứng nhiễm khuẩn huyết và tử vong. Nhọt bày là nhiều đinh nhọt mọc liên tiếp hết đợt này đến đợt khác dai dẳng hàng tháng. Thường gặp ở người suy nhược, giảm sức đề kháng. Ðiều trị: kháng sinh đủ mạnh, dùng càng sớm càng tốt. Có thể cho uống, tiêm hoặc truyền tĩnh mạch. Dùng các vitamin, đạm, gama globulin để nâng cao sức đề kháng của cơ thể. Tại chỗ tuyệt đối không chích nặn ở giai đoạn đang viêm tấy, chưa hóa mủ. Bởi vì nặn sớm sẽ dễ bị biến chứng nhiễm khuẩn huyết, rất nguy hiểm. Nhọt ổ gà: là một viêm nang, kèm theo viêm tuyến mồ hôi, tuyến bã ở vùng nách, tạo thành một túi mủ sâu ở bì và hạ bì. Tổn thương nổi thành cục ở vùng nách, ban đầu cứng sau mềm dần, vỡ mủ. Có thể có một hoặc nhiều nhọt ổ gà trong một hố nách. Bệnh thường tiến triển dai dẳng, hay tái phát, nhất là về mùa hè. Ðiều trị: dùng kháng sinh toàn thân từng đợt. Ðối với tổn thương tái phát nhiều lần có thể phải phẫu thuật. Viêm da mủ do liên cầu khuẩn Chốc lây: do tụ cầu khuẩn và liên cầu khuẩn phối hợp gây bệnh. Trẻ em hay bị hơn người lớn. Vị trí hay gặp là đầu, mặt, cổ, chân tay. Bệnh rất dễ lây từ trẻ này sang trẻ khác, nên có thể thành dịch ở nhà trẻ, trường học. ở trẻ em, chốc đầu tạo thành từng đám vẩy vàng sâu dính bết tóc, dưới lớp vảy, da trợt đỏ, rớm dịch. Hạch ở vùng lân cận thường sưng đau. Bệnh có thể gây biến chứng viêm cầu thận cấp biểu hiện bằng phù, tiểu ít, xét nghiệm có protein niệu. Ðiều trị: phải dùng kháng sinh toàn thân sớm tại chỗ. Dùng các thuốc sát trùng bôi, đắp gạc cho bong hết vẩy, sau đó bôi xanh methylen 1% hoặc dùng dung dịch milian. Khi vẩy tróc bong hết có thể bôi các loại mỡ kháng sinh Chốc loét: là một loại chốc, nhưng tổn thương lan sâu đến trung bì. Thường gặp chốc loét ở bệnh nhân suy dinh dưỡng có bệnh tiểu đường hoặc nghiện rượu. Vị trí: hay gặp ở cẳng chân, cổ chân, nhất là ở chân có giãn tĩnh mạch. Bệnh bắt đầu như chốc lây bằng một phỏng nước hoặc phỏng mủ. Da xung quanh vết loét tím tái, tiến triển dai dẳng, lâu liền sẹo. Ðiều trị: phải dùng kháng sinh nhiều đợt, kết hợp với vitamin, đạm, chiếu tia cực tím. Hăm kẽ: còn gọi là viêm bì thượng bì vi khuẩn. Thường gặp ở trẻ em, nhất là trẻ em mập mạp hoặc ở người lớn béo mập, ra mồ hôi nhiều. Hăm kẽ thường thấy ở nếp cổ, kẽ bẹn, kẽ mông, kẽ sau tai, rốn. Tổn thương là các đám đỏ, trợt, rớm dịch, phía ngoài thường có viền róc da mỏng, đau rát. Ðiều trị: rửa sạch tổn thương bằng nước thuốc tím 1/4.000. Chấm dung dịch yarish. Chốc mép: thường gặp ở trẻ em. Tổn thương đơn độc hoặc kèm theo các tổn thương khác do liên cầu khuẩn. Hai kẽ mép bị nứt trợt, rớm dịch, đóng vẩy vàng dễ chảy máu, đau rát làm cho trẻ khó ăn, khó uống. Có thể lây do uống chung chén, dùng chung khăn mặt. Thường kèm theo sưng đau hạch dưới hàm. Ðiều trị: chấm dung dịch yarish, thuốc màu, thuốc mỡ kháng sinh."
Vài điều lưu ý khi sử dụng mỹ phẩm ,"Đôi khi, bạn chọn mua cây son, kem chống nắng... đắt tiền và thường để lâu. Bạn có biết, khi dùng mỹ phẩm được cất giữ quá lâu sẽ gây ra tình trạng da mẩn, sần sùi, mắt đỏ... Dưới đây là vài thông tin về thời hạn và cách giữ gìn các loại mỹ phẩm dễ bị hỏng. . Thời hạn 3 - 6 tháng: Mascara, kem dưỡng da, kem chống nắng, kem làm nâu da và sản phẩm tẩy lông. Từ 6 - 12 tháng: Mỹ phẩm có sữa và nước như: nước tẩy trắng, sữa tắm, dưỡng da toàn thân, kem lót, chì kẻ mắt, môi, son dưỡng môi. Từ 12 - 24 tháng: Các sản phẩm có chứa thành phần tinh dầu, phấn bột, phấn bánh, sơn móng tay. Mascara: Đây là sản phẩm bạn cần phải cẩn trọng khi bảo quản và sử dụng vì được sử dụng trên vùng da nhạy cảm, dễ tổn thương nhất của gương mặt. Trước tiên, bạn nên chọn mua sản phẩm của các hãng mỹ phẩm uy tín, chất lượng. Đặc biệt, bạn không nên bỏ qua giai đoạn kiểm tra xem mình có bị dị ứng với sản phẩm hay không. Trong quá trình sử dụng, nên chú ý sao cho lúc nào nước chải lông mi cũng phải ngập chổi, không để chổi khô. Kem chống nắng: Không nên sử dụng loại kem của năm ngoái vì loại này có thể thay màu, đổi mùi, tính chất cản nắng bị suy giảm và sẽ mất khả năng bảo vệ cho làn da. Kem lót và son môi: Cách bảo quản tốt nhất là đậy và vặn nút thật chặt, để nơi khô ráo, thoáng mát, không bị ánh nắng mặt trời trực tiếp chiếu vào. Ngoài ra, bạn cũng nên nhớ, các loại dụng cụ trang điểm như chổi, cọ, bàn chải... cần phải được vệ sinh sạch sẽ thường xuyên. Đây chính là con đường để vi khuẩn dễ dàng xâm nhập vào da bạn."
Rối loạn cương và bệnh tim mạch,"Tôi năm nay 40 tuổi, chồng tôi 52 tuổi, thời gian gần đây chuyện sinh hoạt vợ chồng sút giảm hẳn. Tôi lo lắng lắm vì nghe nói bất lực do nhiều nguyên nhân gây ra, trong đó có bệnh cao huyết áp. Xin bác sĩ cho biết điều này có đúng không? Một độc giả (quận 10) Tiến sĩ Nguyễn Hữu Đức, giảng viên Đại học Y Dược TPHCM, trả lời: Cơ chế của cương cứng là khi có kích thích tình dục (ở giác quan hoặc do sự liên tưởng của trí não) thì hệ thần kinh hoạt động thông qua sự dẫn truyền của thần kinh làm cho máu dồn về dương vật, khiến bộ phận này căng phồng lên. Cương cứng được xem là kết quả của sự tổng hợp hài hòa các yếu tố: thần kinh-tâm lý, nội tiết, tuần hoàn-mạch máu, giải phẫu-mô học của cơ quan sinh dục nam. Khiếm khuyết một trong những yếu tố trên sẽ làm giảm lượng máu đến dương vật, gây rối loạn cương (RLC). RLC và cao huyết áp có một điểm chung, đó là kết quả của một tổn thương thực thể, sự co hẹp của mạch máu. RLC thường là dấu hiệu đầu tiên của việc giảm tưới máu hay giảm tuần hoàn của cơ thể, là một rối loạn có thể dễ dàng phát hiện, trong khi cao huyết áp thường là tiềm ẩn, bệnh nhân không biết mình bị cao huyết áp trong một thời gian dài. Một thăm dò cho thấy tỉ lệ cao huyết áp ở nam giới bị RLC cao hơn nam giới không bị RLC đến 38%. Do đó, người ta khuyên khi có RLC, nam giới nên đến bác sĩ để phát hiện và điều trị những bệnh nguy hiểm tiềm ẩn, trong đó có cao huyết áp, để phòng ngừa các biến chứng nguy hiểm như đột quỵ hay tai biến mạch máu não có thể xảy ra."
Lưu ý khi sử dụng son môi,"Lưu ý khi sử dụng son môi Không gì tôn vinh vẻ gợi cảm của đôi môi thiếu nữ đắc địa hơn một ít son hồng. Tuy vậy, nếu biết rằng sơn môi không hoàn toàn vô hại như bạn tưởng thì chút kiêng dè khi sử dụng chúng cũng là việc nên làm. Chất dầu, sáp ong, phẩm màu và một số chất bảo quản khác là những thành phần chính trong son môi. Trong đó phẩm màu là “át chủ bài” và cũng là kẻ có tiềm năng gây rắc rối cho cơ thể của bạn. Thông thường, người ta dùng một loại axít đặc biệt (còn gọi là axít đỏ) để nhuộm màu nhưng đây lại là loại sắc tố không nên có mặt thường xuyên trong cơ thể (độc cho gan, thận). Lanolin cũng là thành phần quan trọng thường có trong son môi. Nhiều cảnh báo cho biết chúng có thể ngấm qua da và đặc biệt, có tính năng như một máy hút bụi tham lam vơ về mình đủ thứ bụi bặm, phân tử rắn (kim loại, silic..,), nấm mốc và các vi sinh vật quần đảo dày đặc trong không khí. Tai hại ở chỗ, con đường từ môi vào miệng ngắn “tày gang nên khi bạn nói, ăn, uống hay... liếm môi thì những kẻ không mời mà đến kia chẳng ngại gì mà không tìm lối lọt vào khoang miệng. Nhãn tiền, nếu đó là những chất gây dị ứng hay các vi khuẩn gây bệnh thì khoang miệng là kẻ chịu trận đầu tiên (bỏng rộp, ngứa ngáy, nứt nẻ, viêm tấy, bưng mủ,...). Chưa dừng lại khi những chất độc tiếp tục quá giang theo nước bọt chu du xa hơn thì đến lượt dạ dày, tuần hoàn, gan, thận... mang vạ. Cần lưu ý thêm, vài loại son môi có khả năng gia tăng hiện tượng nhạy cảm ánh sáng (bắt nắng) gây sạm da trong đó có môi. Do vậy, các fan môi trầm Hàn Quốc có lẽ cũng nên nhớ lại một nguyên lý đơn giản là vật có màu càng sậm thì càng dễ bắt nắng, bắt nhiệt. Một điều tế nhị khác mà các bạn gái trẻ không nên bỏ qua: đôi môi là một trong những vị trí nhạy cảm nhất nhì trên cơ thể phụ nữ bởi đó là nơi tập trung rất nhiều đầu mút thần kinh xúc giác. Việc tô son môi quá tham, quá thường xuyên sẽ vô tình tạo ra lớp màn chắn tước mất cơ hội thực hành của các đầu mút thần kinh. Lâu ngày thiếu điều kiện văn ôn, võ luyện những dây thần kinh tinh tế này sẽ mất dần sự tinh nhạy, cùn mòn cảm giác. Đây có thể là một thiệt thòi lớn cho các bạn gái khi... nụ hôn ngọt ngào hóa ra nhạt như nước ốc!."
Tiểu đường có nên ăn dừa?,"Chất béo từ cơm dừa là loại axít béo no, không có lợi cho người tiểu đường. Do đó, chồng bạn không nên dùng, tuy nhiên nếu thèm thì ăn một chút cũng không hề gì."
Dị ứng mùa mưa ,"Nguyễn Thị Hạnh (Vĩnh Long) - ThS-BS Hồ Xuân Vương, chuyên khoa da liễu, trả lời: Theo mô tả của chị, đó là tình trạng dị ứng mùa, còn gọi là bệnh mề đay. Bệnh thường xảy ra ở người có cơ địa dị ứng, gặp vào mùa mưa, nhất là sau khi tiếp xúc trực tiếp với nước mưa. Bệnh thường gây ngứa nhiều, kèm nổi sẩn đỏ 2 lòng bàn tay, bàn chân. Càng cào gãi thì các nốt này càng nổi đỏ. Nốt nổi lên và biến mất sau vài giờ, đôi khi tồn tại đến 24 giờ hoặc hơn nữa. Chị có thể sử dụng một trong các thuốc sau: - Thuốc kháng dị ứng không gây buồn ngủ: Cetirizine 10mg ( Virlix, Cezil, Cetrine), Loratadine 10mg, DesLoratadine 5mg, Levo-cetirizine.... Uống một viên buổi sáng. - Thuốc kháng dị ứng gây buồn ngủ: Chlorpheniramine 4mg, Polaramine 6mg, Hydroxyzine 25mg (Atarax), Periactine 4mg (Peritol)... Uống một viên buổi tối. Trường hợp ngứa nhiều có thể kết hợp một viên thuốc nhóm không gây ngủ vào buổi sáng và một viên thuốc gây buồn ngủ vào buổi tối. Tuy nhiên, bệnh cần được điều trị và theo dõi bởi bác sĩ chuyên khoa da liễu, để được chẩn đoán, xét nghiệm và hướng dẫn cụ thể hơn về sử dụng thuốc. Mặt khác, vào mùa mưa, do da dễ kích thích, chị nên tránh mang giày dép bó chật vì điều này dễ gây kích ứng da. Khi tiếp xúc với nước mưa, nên rửa sạch ngay bằng nước ấm và lau khô."
